animal,Common_Name,Family,Family_Common,Alternatives and notes,selector_caption,Selector_Caption
Stercorarius_longicaudus,Long-tailed Jaeger,Stercorariidae,Spheniscidae (Penguins),,Stercorarius longicaudus (long-tailed jaeger),Stercorarius longicaudus (Long-tailed Jaeger)
Stercorarius_parasiticus,Arctic Jaeger,Stercorariidae,Spheniscidae (Penguins),,Stercorarius parasiticus (Arctic jaeger),Stercorarius parasiticus (Arctic Jaeger)
Stercorarius_pomarinus,Pomarine Skua,Stercorariidae,Spheniscidae (Penguins),,Stercorarius pomarinus (Pomarine skua),Stercorarius pomarinus (Pomarine Skua)
Morus_bassanus,Northern Gannet,Sulidae,Sulidae (Gannets & Boobies),,Morus bassanus (northern gannet),Morus bassanus (Northern Gannet)
Morus_capensis,Cape Gannet,Sulidae,Sulidae (Gannets & Boobies),,Morus capensis (Cape gannet),Morus capensis (Cape Gannet)
Morus_serrator,Australasian Gannet,Sulidae,Sulidae (Gannets & Boobies),,Morus serrator (Australasian gannet),Morus serrator (Australasian Gannet)
Papasula_abbotti,Abbott's Booby,Sulidae,Sulidae (Gannets & Boobies),,Papasula abbotti (Abbott's booby),Papasula abbotti (Abbott's Booby)
Sula_dactylatra,Masked Booby,Sulidae,Sulidae (Gannets & Boobies),,Sula dactylatra (masked booby),Sula dactylatra (Masked Booby)
Sula_granti,Nazca Booby,Sulidae,Sulidae (Gannets & Boobies),,Sula granti (Nazca booby),Sula granti (Nazca Booby)
Sula_leucogaster,Brown Booby,Sulidae,Sulidae (Gannets & Boobies),,Sula leucogaster (brown booby),Sula leucogaster (Brown Booby)
Sula_nebouxii,Blue-footed Booby,Sulidae,Sulidae (Gannets & Boobies),,Sula nebouxii (blue-footed booby),Sula nebouxii (Blue-footed Booby)
Sula_sula,Red-footed Booby,Sulidae,Sulidae (Gannets & Boobies),,Sula sula (red-footed booby),Sula sula (Red-footed Booby)
Sula_variegata,Peruvian Booby,Sulidae,Sulidae (Gannets & Boobies),,Sula variegata (Peruvian booby),Sula variegata (Peruvian Booby)
